{
  "schema_version": "frequency-feature-verification.v0.1",
  "status": "passed",
  "frequency_axis": {
    "low_hz": 20.0,
    "high_hz": 400.0,
    "df_hz": 1.0
  },
  "checks": [
    {
      "name": "uniform_mdf",
      "observed": 210.0,
      "expected": 210.0,
      "absolute_tolerance": 1e-12,
      "passed": true
    },
    {
      "name": "uniform_mnf",
      "observed": 210.0,
      "expected": 210.0,
      "absolute_tolerance": 1e-12,
      "passed": true
    },
    {
      "name": "single_bin_mdf",
      "observed": 80.0,
      "expected": 80.0,
      "absolute_tolerance": 1e-12,
      "passed": true
    },
    {
      "name": "single_bin_mnf",
      "observed": 80.0,
      "expected": 80.0,
      "absolute_tolerance": 1e-12,
      "passed": true
    },
    {
      "name": "weighted_mnf",
      "observed": 105.0,
      "expected": 105.0,
      "absolute_tolerance": 1e-12,
      "passed": true
    },
    {
      "name": "weighted_mdf_inside_dominant_bin",
      "observed": 119.83333333333333,
      "expected_interval": [
        119.5,
        120.5
      ],
      "passed": true
    },
    {
      "name": "scale_invariant_mdf",
      "observed": 100.0000007497778,
      "expected": 100.0000007497778,
      "absolute_tolerance": 1e-12,
      "passed": true
    },
    {
      "name": "scale_invariant_mnf",
      "observed": 100.00000331653627,
      "expected": 100.00000331653625,
      "absolute_tolerance": 1e-12,
      "passed": true
    }
  ],
  "limitations": [
    "Kiểm chứng dùng PSD synthetic có nghiệm biết trước.",
    "Kết quả không phải clinical validation hoặc fatigue classification."
  ]
}
